{
  "evidencePackId": "MMI3GHIGH_HNAV_BASELINE_001",
  "scope": "Sanitized identity, historical Auto-Scan and UI-observation intake for Audi MMI 3G High HNAV baseline HNAV-8T1035664F-K0257-D1.",
  "campaignId": "C-004",
  "baselineId": "HNAV-8T1035664F-K0257-D1",
  "status": "PARTIAL",
  "createdAt": "2026-07-12T00:00:00+02:00",
  "createdBy": "repository-maintainer",
  "sanitized": true,
  "privacyNotes": "No full VIN, plate, customer data, private path, access code, serial number, coding value, WSC, VCID, proprietary URL or binary package is included.",
  "items": [
    {
      "evidenceId": "HNAV-EV-002",
      "name": "5F diagnostic controller identification",
      "targetFile": "controller_identification.json",
      "sourceFile": "autoscan_sanitized_extract_2026-05-12.md",
      "status": "CAPTURED",
      "risk": "LOW",
      "requiredBefore": "Controller identity claim review",
      "sanitized": true,
      "notes": "The 2026-05-12 Auto-Scan directly captures 5F part number, hardware identifier, component and software level for that scan. Engineering-menu firmware train, Variant, RadioUnit and Sample remain PARTIAL."
    },
    {
      "evidenceId": "HNAV-EV-001",
      "name": "Historical full Auto-Scan context",
      "targetFile": "autoscan_summary_2026-05-12.json",
      "sourceFile": "PRIVATE_RAW_AUTOSCAN_2026-05-12",
      "status": "PARTIAL",
      "risk": "MEDIUM",
      "requiredBefore": "Network and module-context review",
      "sanitized": true,
      "notes": "A reviewed public-safe summary and extract are attached. The raw full scan remains private and this historical scan does not replace a fresh pre-experiment scan."
    },
    {
      "evidenceId": "HNAV-EV-003",
      "name": "Red Engineering Menu identification",
      "targetFile": "red_menu_observation.json",
      "sourceFile": "PRIOR_CHAT_SCREENSHOT_RECOVERY.md",
      "status": "PARTIAL",
      "risk": "MEDIUM",
      "requiredBefore": "Software train and variant corroboration",
      "sanitized": true,
      "notes": "Recovered prior-chat readings exist, but original image files and exact menu path are not attached. No update, emergency or SWDL action is authorized."
    },
    {
      "evidenceId": "HNAV-EV-009",
      "name": "Green Menu structure observation",
      "targetFile": "green_menu_structure_observation.json",
      "sourceFile": "PRIOR_CHAT_SCREENSHOT_RECOVERY.md",
      "status": "PARTIAL",
      "risk": "LOW",
      "requiredBefore": "Green Menu structure review",
      "sanitized": true,
      "notes": "Recovered from prior user-supplied screenshot discussions. Visibility does not confirm function."
    },
    {
      "evidenceId": "HNAV-EV-011",
      "name": "Green Menu diagnostic fault observations",
      "targetFile": "green_menu_diagnostic_observation.json",
      "sourceFile": "PRIOR_CHAT_SCREENSHOT_RECOVERY.md",
      "status": "PARTIAL",
      "risk": "MEDIUM",
      "requiredBefore": "HDD and function-restriction interpretation",
      "sanitized": true,
      "notes": "Recovered display strings are observations only and do not establish root cause."
    },
    {
      "evidenceId": "HNAV-EV-012",
      "name": "Green Menu NADPhone version observation",
      "targetFile": "green_menu_nadphone_observation.json",
      "sourceFile": "PRIOR_CHAT_SCREENSHOT_RECOVERY.md",
      "status": "PARTIAL",
      "risk": "LOW",
      "requiredBefore": "Telephone/NADPhone context review",
      "sanitized": true,
      "notes": "The recovered $ERROR$ display does not prove module presence, failure mode or telephone functionality."
    },
    {
      "evidenceId": "HNAV-EV-006",
      "name": "Historical DTC-before context",
      "targetFile": "dtc_baseline_2026-05-12.json",
      "sourceFile": "PRIVATE_RAW_AUTOSCAN_2026-05-12",
      "status": "PARTIAL",
      "risk": "HIGH",
      "requiredBefore": "Fault attribution or controlled testing",
      "sanitized": true,
      "notes": "DTCs for 19, 5F and 6C were extracted and reviewed. A fresh current DTC-before capture remains required before any controlled experiment."
    },
    {
      "evidenceId": "HNAV-EV-013",
      "name": "Auto-Scan sanitization and provenance review",
      "targetFile": "AUTOSCAN_SANITIZATION_REVIEW_2026-07-12.md",
      "sourceFile": "PRIVATE_RAW_AUTOSCAN_2026-05-12",
      "status": "CAPTURED",
      "risk": "LOW",
      "requiredBefore": "Public repository intake",
      "sanitized": true,
      "notes": "Records selection, exclusions, privacy review, source limitations and the distinction between the directly available 265250 km scan and the report-only 268420 km EP-001 scan."
    },
    {
      "evidenceId": "HNAV-EV-004",
      "name": "Original coding backup",
      "targetFile": "coding_before_sanitized.txt",
      "sourceFile": "TO_CAPTURE",
      "status": "TO_CAPTURE",
      "risk": "HIGH",
      "requiredBefore": "Any coding research",
      "sanitized": false,
      "notes": "The Auto-Scan showed that a coding field exists, but the coding value is intentionally not stored in this public intake."
    },
    {
      "evidenceId": "HNAV-EV-005",
      "name": "Read-only adaptation map",
      "targetFile": "adaptation_map_before_sanitized.csv",
      "sourceFile": "TO_CAPTURE",
      "status": "TO_CAPTURE",
      "risk": "HIGH",
      "requiredBefore": "Any adaptation research",
      "sanitized": false,
      "notes": "No adaptation value is included in this intake."
    },
    {
      "evidenceId": "HNAV-EV-010",
      "name": "Dataset and recovery backup",
      "targetFile": "PRIVATE_BACKUP_REFERENCE_ONLY",
      "sourceFile": "NOT_PUBLIC",
      "status": "BLOCKED",
      "risk": "CRITICAL",
      "requiredBefore": "Any dataset, parameterization or SWDL research",
      "sanitized": false,
      "notes": "Binary packages, access material and private recovery assets must not be published in this intake."
    }
  ],
  "blockedClaims": [
    "The 5F diagnostic identity applies unchanged outside the 2026-05-12 scan context.",
    "The engineering-menu firmware train, Variant, RadioUnit or Sample is confirmed by the Auto-Scan.",
    "Sample d1 is proven to be equivalent to hwSample.",
    "The historical Auto-Scan represents the current pre-experiment state.",
    "Green Menu visibility proves feature availability or functionality.",
    "Green Menu or Auto-Scan DTC strings establish a confirmed root cause.",
    "Coding or adaptation behavior is confirmed.",
    "Security Access is known, valid or required for a specific operation.",
    "Dataset, parameterization, emergency update or SWDL operations are safe.",
    "HNAV to HN+ conversion feasibility or barrier location is established."
  ],
  "notes": "The package now contains a directly sourced sanitized historical Auto-Scan summary and DTC extract. It remains PARTIAL because original Red/Green Menu images, a fresh current scan, coding backup, adaptation map and recovery assets are still missing."
}